{
  "schema_version": 1,
  "initialized": true,
  "inspection": "metadata-only",
  "managed_dotenv": {
    "inspected": false
  },
  "vault": {
    "inspected": false
  },
  "proxy": {
    "lifecycle_lock": "unknown",
    "listener_authenticated": false
  },
  "issues": [
    "proxy-lock-unavailable"
  ]
}
