{
  "schema_version": 1,
  "initialized": false,
  "inspection": "metadata-only",
  "managed_dotenv": {
    "inspected": false
  },
  "vault": {
    "inspected": false
  },
  "proxy": {
    "lifecycle_lock": "not-inspected",
    "listener_authenticated": false
  },
  "issues": [
    "config-missing"
  ]
}
